{
  "schema_version": 1,
  "gate": "P-1140F",
  "state": "reviewed",
  "reviewed_commit": "46bf2fa47963261d48fa80a6980de85d80cfaad8",
  "validation_run": 31606983374,
  "finding_registry_sha256": "7791b82d637d9c022bbd88d11650113153512c4f17acf540da69957f299f663c",
  "artifact_registry_sha256": "5a4c90b29348f600fb342a97c3221319014b21b98bd5324eba360ad89f5a269d",
  "review_verdict": "pass",
  "reviewed_at": "2026-08-12T14:30:00Z",
  "limitations": [
    "This review is not independent. It was performed under delegated owner authority by the same agent that performed the repairs. SR-016 is the finding about review-record integrity, so this verdict is an instance of the thing that finding governs. The mechanical criteria - artifact coverage, evidence format, unit status - are machine-checked and cannot be talked around; the judgement about whether a repair is adequate is not.",
    "These are contract repairs. Nothing in this repository is implemented, so no finding is closed on runtime evidence. A closed finding means the recorded contradiction is gone from the documents, never that the behaviour is correct.",
    "D-012, D-043 and D-046 remain open decisions with stated missing evidence. They are not findings and do not block the gate, and each names what would close it.",
    "The reviewed head carries a defect found after it was pinned. 46bf2fa47963261d48fa80a6980de85d80cfaad8 tracks `.venv` as a symlink to an absolute path on one machine, which the workspace boundary in AGENTS.md forbids and which broke checkouts twice by replacing a real virtualenv with a symlink to itself. It was removed in a1b2cc61dca7404ec895b18ca6695442cb167f8d, three commits after the pin. The pin is not moved, because re-pointing it at a commit no one reviewed would be a larger claim than the one being corrected; the defect is disclosed here instead. Nothing checks a repository for tracked machine-local paths, which is why it reached a head that was stamped pass.",
    "Three findings closed without citing a unit that served them. An independent review of this head found SR-007 closed without citing PF-073 and retaining a sentence saying the receipt divergence was still open when PF-073 had closed it, and SR-009 closed without citing PF-074 - the unit that is this reviewed head. A third, SR-009 not citing PF-016, was found by the check written in response. All three are repaired and the converse check now exists: a landed unit declaring Serves: must be cited by any settled finding it serves. The verdict stands, but it was reached over a record that was incomplete in three places, and no validator objected."
  ]
}
